{
  "schemaVersion": 1,
  "boardId": "qtpi-veda-esp32",
  "flavorId": "micropython",
  "version": "1.1.0",
  "source": {
    "repository": "QtLearnCodeLab/qtmicropython",
    "commit": "72422226a2a6585cf72e24be51034cdd8b0d84cd",
    "tag": "qtpi-esp32-micropython-v1.1.0"
  },
  "dependencies": {
    "espIdf": "v5.5",
    "micropython": "1.27.0-preview",
    "uqtpy": "1.1.0"
  },
  "images": [
    {
      "role": "complete",
      "file": "qtpi-esp32-micropython-v1.1.0.bin",
      "offset": "0x0000",
      "sha256": "af0e99b80cf9508425778a87bb66277424af0e2481dba00fb112e3a82d2257da",
      "sizeBytes": 15794176,
      "contains": [
        {
          "role": "firmware",
          "file": "firmware.bin",
          "offset": "0x1000",
          "sha256": "39b394f1e687dd6b2d28098ad59e79bc091ecbc529dbc210b5f366ca7704b846",
          "sizeBytes": 1912064
        },
        {
          "role": "littlefs",
          "file": "qtpi_lfs.bin",
          "offset": "0x610000",
          "sha256": "ede7bd01e624210bc2f022b65bee1bd189f37046d92aa1d7d557a4043ad41555",
          "sizeBytes": 9437184
        }
      ]
    }
  ],
  "flash": {
    "chip": "esp32",
    "size": "16MB",
    "mode": "dio",
    "freq": "80m"
  },
  "requiresErase": false
}
